{
  "schemaVersion": 1,
  "projectTitle": "방구석 스트리머들의 전국투어",
  "vod": {
    "url": "https://chzzk.naver.com/video/1234567",
    "title": "방구석 스트리머들의 전국투어",
    "id": "1234567"
  },
  "markers": [
    {
      "id": "00000000-0000-4000-8000-000000000001",
      "type": "point",
      "time": 18960,
      "pre": 10,
      "post": 20,
      "comment": "원주 토크 시작.\n노랑 자막으로 치킨쿤의 인생 토크 중 표시 후 빠르게 넘김.",
      "createdAt": "2026-09-28T10:00:00.000Z"
    },
    {
      "id": "00000000-0000-4000-8000-000000000002",
      "type": "point",
      "time": 18978,
      "pre": 10,
      "post": 20,
      "comment": "치킨쿤 초등학교 / 씨름부 / 학생수 400명 이야기.\n빅헤드 \"야 많은거야! 섭종 정도는 아냐!\"",
      "createdAt": "2026-09-28T10:01:00.000Z"
    },
    {
      "id": "00000000-0000-4000-8000-000000000003",
      "type": "point",
      "time": 19090,
      "pre": 10,
      "post": 20,
      "comment": "탬탬버린 \"역도 있어\"\n서울 깍쟁이 토크 시작.",
      "createdAt": "2026-09-28T10:02:00.000Z"
    },
    {
      "id": "00000000-0000-4000-8000-000000000004",
      "type": "point",
      "time": 19128,
      "pre": 10,
      "post": 20,
      "comment": "빅헤드 \"역이 없으면 어떻게 이동해요?\"\n버스 / 걸어가나 / 소 타까지.",
      "createdAt": "2026-09-28T10:03:00.000Z"
    },
    {
      "id": "00000000-0000-4000-8000-000000000005",
      "type": "point",
      "time": 19140,
      "pre": 10,
      "post": 20,
      "comment": "원주 인구수 / 이터널리턴 드립.",
      "createdAt": "2026-09-28T10:04:00.000Z"
    },
    {
      "id": "00000000-0000-4000-8000-000000000006",
      "type": "point",
      "time": 19373,
      "pre": 10,
      "post": 20,
      "comment": "방송인은 지방 살아야 한다 / 배세권 / 텅 토크.",
      "createdAt": "2026-09-28T10:05:00.000Z"
    },
    {
      "id": "00000000-0000-4000-8000-000000000007",
      "type": "point",
      "time": 20490,
      "pre": 10,
      "post": 20,
      "comment": "\"스트리머들은 전국여행도 인터넷으로 하는구나\"",
      "createdAt": "2026-09-28T10:06:00.000Z"
    },
    {
      "id": "00000000-0000-4000-8000-000000000008",
      "type": "range",
      "start": 20580,
      "end": 24180,
      "comment": "로드뷰 전국 탐험.\n방구석 스트리머들의 전국투어.",
      "createdAt": "2026-09-28T10:07:00.000Z"
    }
  ],
  "exportedAt": "2026-09-28T11:00:00.000Z",
  "generator": "chzzk-edit-marker/0.1.0"
}
